source	translation	post-edit	bleu	chrf	ter
And Len was wealthy enough to be able to afford a Park Avenue psychoanalyst, who for five years tried to find the sexual trauma that had somehow locked positive emotion inside of him.	Len bakwara ọgaranya ruo n’ókè nke inwe ike inweta otu Ụlọ Ọrụ Na-ahụ Maka Mgbanwe nke Park, bụ́ onye gbalịrị ịchọta ụdị mmekọahụ ahụ bụ́ nke nweworo mmetụta dị mma n’ime ya.		0.00	0.00	32.00
But it turned out there wasn't any sexual trauma.	Ma, ọ bụ n’ebe ahụ ka a na-enwe mmekọahụ ọ bụla.		0.00	0.00	11.00
It turned out that -- Len grew up in Long Island and he played football and watched football, and played bridge -- Len is in the bottom five percent of what we call positive affectivities.	O mesịrị ghọọ onye Len ahụ tolitere na Long Island ma kirie foto ma kirie foto, ma kirie bridge-Len na pasent ise nke ihe anyị na-akpọ ememe ndị dị mma.		0.00	0.00	30.00
The question is, is Len unhappy?	Ajụjụ bụ, Ọ̀ bụ na Len enweghị obi ụtọ?		0.00	0.00	9.00
Contrary to what psychology told us about the bottom 50 percent of the human race in positive affectivity, I think Len is one of the happiest people I know.	N’ụzọ dị iche n’ihe ndị ọkà mmụta banyere akparamàgwà na-agwa anyị banyere pasent 50 nke agbụrụ mmadụ nwere mmetụta dị mma, echere m na Len bụ otu n’ime ndị kasị nwee obi ụtọ m maara.		0.00	0.00	35.00
He's not consigned to the hell of unhappiness and that's because Len, like most of you, is enormously capable of flow.	A machibidoghị hel nke enweghị obi ụtọ na nke ndị ohi n’ihi na Len, dị ka ihe ka ọtụtụ n’ime unu, nwere nnọọ ike ịgbapụ.		0.00	0.00	25.00
When the first card is played, until 10 days later, the tournament is over, time stops for Len.	Mgbe e kenyere kaadị mbụ ahụ, ruo ụbọchị 10 ka e mesịrị, ụlọikwuu ahụ na-akwụsị, oge na-aga maka Len.		0.00	0.00	19.00
And this is indeed what Mike Csikszentmihalyi has been talking about, about flow.	N’ezie, nke a bụkwa ihe Mike Csiksentzenthalyi na-ekwu banyere ya, na-ekwu banyere ya.		0.00	0.00	13.00
But what Mike told you yesterday -- during flow, you can't feel anything.	Ma ihe Mike gwara gị mgbe ị na-eme njem ehihie, ọ dịghị ihe ị na-eche.		0.00	0.00	15.00
You're one with the music.	Egwú na-atọ gị ụtọ.                                                             		0.00	0.00	64.00
And this is indeed the characteristic of what we think of as the good life.	Nke a bụkwa n’ezie àgwà ndị anyị na-eche banyere ha dị ka ezi ndụ.		0.00	0.00	14.00
And we think there's a recipe for it, and it's knowing what your highest strengths are.	Anyị na-echekwa echiche otú ahụ maka ya, ọ na-amakwa ihe ndị kasị ike i nwere.		0.00	0.00	15.00
And again, there's a valid test of what your five highest strengths are.	Ọzọkwa, e si otú ahụ nwalee ezigbo ule nke ihe ise kasị ike i nwere.		0.00	0.00	15.00
And then re-crafting your life to use them as much as you possibly can.	Mgbe ahụ, mee ka ndụ gị dị ụtọ iji ha na-eme ihe otú i nwere ike.		0.00	0.00	16.00
Re-crafting your work, your love, your play, your friendship, your parenting.	Mee ka ọrụ gị na-aga nke ọma, ịhụnanya gị, egwuregwu gị, ọbụenyi gị, nne ma ọ bụ nna gị.		0.00	0.00	19.00
Just one example.	Nanị otu ihe atụ.		0.00	0.00	4.00
She's working her way through college.	Ndị na-arụ ọrụ na mahadum.		0.00	0.00	5.00
Her highest strength was social intelligence, so she re-crafted bagging to make the encounter with her the social highlight of every customer's day.	Ike kasịnụ o nwere bụ ọgụgụ isi nke ọha na eze, n’ihi ya, ọ na-ebu oké ibu iji mee ka ọnọdụ ọha na eze ya pụta ìhè nke ụbọchị ọ bụla a na-eme omenala.		0.00	0.00	34.00
But what she did was to take her highest strengths, and re-craft work to use them as much as possible.	Ma ihe o mere iji wusie ya ike, na-arụsikwa ọrụ ike iji ha eme ihe ruo ókè o kwere mee.		0.00	0.00	20.00
What you get out of that is not smiley-ness.	Ihe ị ga-esi na nke ahụ pụta abụghị ịdị nwayọọ.		0.00	0.00	10.00
You don't look like Debbie Reynolds.	Ị na-ele anya dị ka Debbie Reynolds.		0.00	0.00	7.00
You don't giggle a lot.	Ọ na-eme ka i nwee ọtụtụ ihe ị ga-eme.		0.00	0.00	9.00
So, that's the second path.	N’ihi ya, ọ bụ ụzọ nke abụọ.		0.00	0.00	7.00
The second path is eudaimonian flow.	Ụzọ nke abụọ bụ mkpọda anyanwụ.		0.00	0.00	6.00
And the third path is meaning.	Ụzọ nke atọ nwekwara nzube.		0.00	0.00	5.00
This is the most venerable of the happinesses, traditionally.	Nke a bụ ihe kasị eme ka e nwee obi ụtọ, ọdịnala.		0.00	0.00	12.00
And meaning, in this view, consists of -- very parallel to eudaimonia -- it consists of knowing what your highest strengths are, and using them to belong to and in the service of something larger than you are.	Nke a na-emekwa ka anyị mata ihe ndị kacha ike i nwere, jirikwa ha na-ejere Jehova ozi.		0.00	0.00	17.00
I mentioned that for all three kinds of lives, the pleasant life, the good life, the meaningful life, people are now hard at work on the question, are there things that lastingly change those lives?	Agwara m ya na e nwere ihe atọ na-enye obi ụtọ ná ndụ, ndụ dị mma, ndụ nwere nzube, ndị mmadụ na-arụsi ọrụ ike ugbu a n’ajụjụ a, è nwere ihe ndị na-agbanwe ndụ ndị ahụ?		0.00	0.00	36.00
And the answer seems to be yes.	Azịza ya dịkwa ka ee.		0.00	0.00	5.00
It's being done in a rigorous manner.	A na-eme ya n’ụzọ dị ukwuu.		0.00	0.00	6.00
It's being done in the same way that we test drugs to see what really works.	A na-eme ihe n’otu ụzọ ahụ anyị si nwalee ọgwụ ọjọọ ịhụ ihe bụ́ ọrụ n’ezie.		0.00	0.00	16.00
So we do random assignment, placebo controlled, long-term studies of different interventions.	N’ihi ya, anyị na-arụ ọrụ e nyere anyị, bụ́ ebe a na-achịkwa ma na-eduzi ọmụmụ ihe dị iche iche.		0.00	0.00	19.00
And just to sample the kind of interventions that we find have an effect, when we teach people about the pleasant life, how to have more pleasure in your life, one of your assignments is to take the mindfulness skills, the savoring skills, and you're assigned to design a beautiful day.	Ọ bụrụkwa na anyị na-akụziri ndị mmadụ banyere ndụ obi ụtọ, ọ ga-eme ka i nwee obi ụtọ ná ndụ gị, otu n’ime ọrụ ndị ị na-arụ bụ iji nkà ndị dị mkpa, nkà ndị na-eme ka mmadụ na-eme nke ọma, na otú i si arụ ọrụ ndị dị mma n’ụbọchị mara mma.		0.00	0.00	53.00
Next Saturday, set a day aside, design yourself a beautiful day, and use savoring and mindfulness to enhance those pleasures.	Ọzọkwa, Saturday, wepụta otu ụbọchị, wepụta onwe gị ụbọchị mara mma, ma jiri ịdị uchu na-eme ihe iji mee ka ihe ụtọ ndị ahụ ka mma.		0.00	0.00	26.00
And we can show in that way that the pleasant life is enhanced.	Anyị pụkwara igosipụta n’ụzọ dị otú ahụ na a na-eme ka ndụ dị ụtọ sikwuo ike.		0.00	0.00	16.00
Gratitude visit.	Nleta na-egosi ekele.		0.00	0.00	3.00
I'd like you to remember someone who did something enormously important that changed your life in a good direction, and who you never properly thanked.	Ọ ga-amasị gị icheta onye mere ihe dị oké mkpa nke gbanwere ndụ gị n’ụzọ dị mma, ọ dịghịkwa mgbe ị kelere ya nke ọma.		0.00	0.00	25.00
The person has to be alive.	Onye ahụ aghaghị ịdị ndụ.		0.00	0.00	5.00
Now, OK, you can open your eyes.	Ugbu a, ị pụrụ imeghe anya gị.		0.00	0.00	7.00
I hope all of you have such a person.	Enwere m olileanya na i nwere ụdị onye ahụ.		0.00	0.00	9.00
Your assignment, when you're learning the gratitude visit, is to write a 300-word testimonial to that person, call them on the phone in Phoenix, ask if you can visit, don't tell them why, show up at their door, you read the testimonial -- everyone weeps when this happens.	Ọrụ ị na-arụ, mgbe ị na-amụtakwu otú ị ga-esi na-ekele ya, bụ idegara onye ahụ akwụkwọ ozi iri atọ na atọ, na-akpọ ha na fon dị na Phoenix, na-ajụ ma ị̀ pụrụ ileta ya, na-agwa ha ihe mere o ji dị mma, na-agụ ihe ndị na-agba akaebe a na-eme.		0.00	0.00	49.00
And what happens is when we test people one week later, a month later, three months later, they're both happier and less depressed.	Ihe na-emenụ bụ mgbe anyị nwara ndị mmadụ otu izu mgbe e mesịrị, otu ọnwa ka e mesịrị, ọnwa atọ ka e mesịrị, ha na-enwe obi ụtọ ma na-adakarị mbà n’obi.		0.00	0.00	31.00
Another example is a strength date, in which we get couples to identify their highest strengths on the strengths test, and then to design an evening in which they both use their strengths, and we find this is a strengthener of relationships.	Ihe atụ ọzọ bụ oge anyị ji eme ihe, bụ́ nke anyị na-enweta di na nwunye iji mata ebe ndị kasị ike ha na-enweta n’ule, mgbe ahụkwa, iji kee otu uhuruchi nke ha abụọ ji eme ihe, anyị na-achọkwa nke a bụ ihe na-ewusikwu mmekọrịta ha ike.		0.00	0.00	47.00
But it's so heartening to be in a group like this, in which so many of you have turned your lives to philanthropy.	Ma ọ na-enye nnọọ obi ụtọ ịnọ n’otu ìgwè dị ka nke a, bụ́ nke ọtụtụ n’ime unu meworo ka ndụ unu bụrụ nke nkà ihe ọmụma.		0.00	0.00	27.00
Well, my undergraduates and the people I work with haven't discovered this, so we actually have people do something altruistic and do something fun, and to contrast it.	Ọ dị mma, ndị m na-agụsị akwụkwọ na ndị m na-arụsi ọrụ ike chọtara nke a, n’ihi ya, anyị nwere n’ezie ndị mmadụ ime ihe dị mma ma na-eme ihe dị iche na ya.		0.00	0.00	34.00
And what you find is when you do something fun, it has a square wave walk set.	Ihe ị na-achọkwa bụ mgbe ị na-eme ihe na-atọ ụtọ, ọ na-eji ụkwụ aga ije.		0.00	0.00	15.00
When you do something philanthropic to help another person, it lasts and it lasts.	Mgbe ị na-eme ihe ndị na-akpali agụụ mmekọahụ iji nyere onye ọzọ aka, ọ na-ewe oge, ọ na-adịkwa otú ahụ.		0.00	0.00	20.00
So those are examples of positive interventions.	Ya mere, ndị ahụ bụ ihe atụ nke ihe ndị dị mma.		0.00	0.00	12.00
So, the next to last thing I want to say is we're interested in how much life satisfaction people have.	Ya mere, ihe sochirinụ m chọrọ ikwu bụ enweghị mmasị ná ndụ ndị mmadụ.		0.00	0.00	14.00
And this is really what you're about.	Nke a bụkwa ihe ị na-eme n’ezie.		0.00	0.00	7.00
And we ask the question as a function of the three different lives, how much life satisfaction do you get?	Anyị na-ajụkwa ajụjụ ahụ dị ka ọrụ nke ndụ atọ ahụ dị iche, olee afọ ojuju ị na-enweta?		0.00	0.00	18.00
So we ask -- and we've done this in 15 replications involving thousands of people -- to what extent does the pursuit of pleasure, the pursuit of positive emotion, the pleasant life, the pursuit of engagement, time stopping for you, and the pursuit of meaning contribute to life satisfaction?	N’ihi ya, anyị na-ajụ onwe anyị ma na-adịghị ike ime nke a ná mbipụta 15 ndị metụtara ọtụtụ puku mmadụ ruo n’ókè ha aṅaa ka ịchụso ihe ụtọ, nchụso nke obi ụtọ, ndụ obi ụtọ, nchụso nke afọ ojuju, nchụso nke afọ ojuju, ịchụso nke afọ ojuju, na ịchụso ihe                  		0.00	0.00	67.00
And our results surprised us, but they were backward of what we thought.	Ihe anyị rụpụtara juru anyị anya, ma ha na-azụlite ihe anyị chere.		0.00	0.00	12.00
It turns out the pursuit of pleasure has almost no contribution to life satisfaction.	Ọ na-eme ka ịchụso ihe ụtọ bụrụ ihe fọrọ nke nta ka ọ bụrụ ihe na-eme ka ndụ nwee afọ ojuju.		0.00	0.00	21.00
The pursuit of meaning is the strongest.	Ịchụso ihe ọ pụtara bụ ihe kasị sie ike.		0.00	0.00	9.00
The pursuit of engagement is also very strong.	Ọchịchọ nke nkwekọrịta dịkwa nnọọ ike.		0.00	0.00	6.00
Where pleasure matters is if you have both engagement and you have meaning, then pleasure's the whipped cream and the cherry.	Ọ bụrụ na ihe na-atọ gị ụtọ bụ ma ọ bụrụ na i nwere ma nkwekọrịta ma nwee nzube, mgbe ahụ, obi dị gị ụtọ maka ihe ndị e kere eke a na-achịkwa achịkwa.		0.00	0.00	34.00
Which is to say, the full life -- the sum is greater than the parts, if you've got all three.	Onye nke ọ bụla n’ime ha ga-ekwu na ihe ndị e ji ebi ndụ dị ukwuu karịa akụkụ ahụ́ ndị ahụ, ọ bụrụ na ndị na-eto eto eruo atọ.		0.00	0.00	29.00
Conversely, if you have none of the three, the empty life, the sum is less than the parts.	N’aka nke ọzọ, ọ bụrụ na ọ dịghị nke ọ bụla n’ime mmadụ atọ ahụ, nke kasị baa uru, ego ahụ adịghị mma karịa akụkụ ahụ́ ndị ahụ.		0.00	0.00	28.00
And what we're asking now is does the very same relationship, physical health, morbidity, how long you live and productivity, follow the same relationship?	Nsogbu ndị dịkwa aṅaa ka ịjụ ugbu a bụ nnọọ mmekọrịta anụ ahụ́, ahụ́ ike, omume ọma, ogologo oge ha aṅaa ka ị na-adị ndụ ma na-arụpụta ihe, na-agbaso otu mmekọrịta ahụ?		0.00	0.00	32.00
That is, in a corporation, is productivity a function of positive emotion, engagement and meaning?	Nke ahụ bụ, n’otu akụkụ, ọ̀ na-eme ka mmadụ nwee mmetụta dị mma, nkwekọrịta na nzube?		0.00	0.00	16.00
Is health a function of positive engagement, of pleasure, and of meaning in life?	Ọ̀ bụ ọrụ ahụ́ ike nke inwe afọ ojuju, ihe ụtọ, na nzube nke ndụ?		0.00	0.00	15.00
And there is reason to think the answer to both of those may well be yes.	E nwekwara ihe mere anyị ga-eji chee azịza nke abụọ n’ime ha pụrụ ịbụ ee.		0.00	0.00	15.00
So, Chris said that the last speaker had a chance to try to integrate what he heard, and so this was amazing for me.	Ya mere, Chris kwuru na ọkà okwu ikpeazụ nwere ohere nke ịgbalị ibibi ihe ọ nụrụ, nke a bụkwa ihe ijuanya nye m.		0.00	0.00	23.00
I've never seen speakers stretch beyond themselves so much, which was one of the remarkable things.	Ọ dịtụbeghị mgbe ọ bụla ndị na-ekwu okwu na-ejide onwe ha karịa onwe ha, bụ́ otu n’ime ihe ndị dị ịrịba ama.		0.00	0.00	22.00
But I found that the problems of psychology seemed to be parallel to the problems of technology, entertainment and design in the following way.	Ma achọpụtara m na nsogbu ndị ọkà mmụta banyere akparamàgwà mmadụ yiri ka hà na-enwe nsogbu nke nkà na ụzụ, ntụrụndụ na ihe ndị na-esonụ.		0.00	0.00	25.00
We all know that technology, entertainment and design have been and can be used for destructive purposes.	Anyị nile maara na nkà na ụzụ, ntụrụndụ na ihe ndị e kere eke anọwo na-eme ihe, a pụkwara iji ha mee ihe maka nzube ndị na-ebibi ihe.		0.00	0.00	28.00
We also know that technology, entertainment and design can be used to relieve misery.	Anyị makwaara na nkà na ụzụ, ntụrụndụ na ihe ndị e kere eke pụrụ iji mee ka nhụjuanya kwụsị.		0.00	0.00	19.00
And by the way, the distinction between relieving misery and building happiness is extremely important.	N’ụzọ kwa, ọdịiche dị n’etiti nhụjuanya na iwuli elu dị nnọọ mkpa.		0.00	0.00	12.00
I thought, when I first became a therapist 30 years ago, that if I was good enough to make someone not depressed, not anxious, not angry, that I'd make them happy.	Echere m na mgbe mbụ m ghọrọ onye na-agwọ ọrịa afọ 30 gara aga, na ọ bụrụ na m dị mma ime ka mmadụ ghara ịda mbà n’obi, ọ bụghị iwe, na Ireld na-eme ka ha nwee obi ụtọ.		0.00	0.00	39.00
And I never found that.	Ahụtụbeghị m nke ahụ.		0.00	0.00	4.00
And it turns out the skills of happiness, the skills of the pleasant life, the skills of engagement, the skills of meaning, are different from the skills of relieving misery.	Ọ na-emekwa ka nkà nke obi ụtọ, nkà nke ndụ na-enye obi ụtọ, nkà nke inwe ihe ịga nke ọma, nkà nke nzube, dị iche na nkà nke nhụjuanya ndị a pụrụ ịdabere na ha.		0.00	0.00	35.00
And so, the parallel thing holds with technology, entertainment and design, I believe.	Otú ọ dị, ihe yiri nke ahụ nwere nkà na ụzụ, ntụrụndụ na ihe ndị e kere eke, ekweere m.		0.00	0.00	20.00
That is, it is possible for these three drivers of our world to increase happiness, to increase positive emotion, and that's typically how they've been used.	Nke ahụ bụ na ọ pụrụ ikwe ndị ọkwọ ụgbọala atọ a nke ụwa anyị omume ịmụba obi ụtọ, ịmụba mmetụta ndị dị mma, na-emekwa ka e jiri ha mee ihe n’ụzọ ụfọdụ.		0.00	0.00	33.00
But once you fractionate happiness the way I do -- not just positive emotion, that's not nearly enough -- there's flow in life, and there's meaning in life.	Ma ozugbo ị na-eme ka obi na-atọ m ụtọ otú m si eche echiche nke ọma, ọ dịghị ihe fọrọ nke nta ka ọ bụrụ na ọ fọrọ nke nta ka ọ bụrụ na ị na-enwe obi ụtọ ná ndụ, ọ bụkwa otú ahụ ka ọ dị ná ndụ.		0.00	0.00	49.00
As Laura Lee told us, design, and, I believe, entertainment and technology, can be used to increase meaning engagement in life as well.	Dị ka Laura Lee gwara anyị, ihe ndị e kere eke, na, ekweere m, ntụrụndụ na nkà na ụzụ, a pụrụ iji mee ihe iji mụbaa ọganihu ná ndụ.		0.00	0.00	29.00
So in conclusion, the eleventh reason for optimism, in addition to the space elevator, is that I think with technology, entertainment and design, we can actually increase the amount of tonnage of human happiness on the planet.	N’ihi ya, ná ngwụsị, ihe nke asaa mere anyị ga-eji nwee olileanya, tinyekwara onye na-arụ ọrụ n’obí eze, bụ na m na-eche banyere nkà na ụzụ, ntụrụndụ na ihe ndị e kere eke, anyị pụrụ n’ezie ịmụba ọnụ ọgụgụ dị ukwuu nke inwe obi ụtọ n’ụwa.		0.00	0.00	46.00
And if technology can, in the next decade or two, increase the pleasant life, the good life and the meaningful life, it will be good enough.	Ọ bụrụkwa na nkà na ụzụ pụrụ, n’afọ iri na abụọ na-esonụ ma ọ bụ abụọ, na-amụba ndụ obi ụtọ, ndụ dị mma na ndụ nwere nzube, ọ ga-ezuru ya.		0.00	0.00	30.00
If entertainment can be diverted to also increase positive emotion, meaning, eudaimonia, it will be good enough.	Ọ bụrụ na a pụrụ iwepụta ntụrụndụ iji mụbaa mmetụta dị mma, nke pụtara, nke pụtara, nke na-edozi ahụ́, ọ ga-adị mma.		0.00	0.00	22.00
And if design can increase positive emotion, eudaimonia, and flow and meaning, what we're all doing together will become good enough.	Ọ bụrụkwa na ihe ndị e kere eke pụrụ ịmụba mmetụta ndị dị mma, eudaimonia, na nke na-aga n’ihu, ihe na-adịghị mma mmadụ nile na-eme ga-aghọ ihe dị mma.		0.00	0.00	29.00
And it may be that passing the 50 percent urban point is an economic tipping point.	Ọ pụkwara ịbụ na ịgafe ihe dị ka pasent 50 nke ụlọ akụ̀ bụ ihe na-akpata ego.		0.00	0.00	17.00
It used to be that Paris and London and New York were the largest cities.	Ọ bụ na Paris na London na New York bụ obodo kasị ukwuu.		0.00	0.00	13.00
What we have now is the end of the rise of the West.	Ihe anyị nwere ugbu a bụ ọgwụgwụ nke ọdịda anyanwụ nke Ebe Ọdịda Anyanwụ Ụwa.		0.00	0.00	15.00
So what's really going on?	Ya mere, olee ihe ndị na-aga n’ihu n’ezie?		0.00	0.00	8.00
And here's the unromantic truth -- and the city air makes you free, they said in Renaissance Germany.	Ha na-ekwukwa na Renaissance Germany,                                                             		0.00	0.00	65.00
And these are not really a people oppressed by poverty.	Ihe ndị a abụghị n’ezie ndị ogbenye na-emegbu.		0.00	0.00	8.00
They're people getting out of poverty as fast as they can.	Ndị mmadụ na-esi n’ogbenye apụta dị ka ha pụrụ.		0.00	0.00	9.00
They're the dominant builders and to a large extent, the dominant designers.	Ahụhụ bụ ndị na-ewu ebe obibi na ndị buru ibu, ndị bụ́ isi.		0.00	0.00	13.00
They have home-brewed infrastructure and vibrant urban life.	Ha nwere mbibi ndị na-ebibi ihe na ihe ndị na-adịghị mma.		0.00	0.00	11.00
One-sixth of the GDP in India is coming out of Mumbai.	Otu ụzọ n’ụzọ isii nke ndị GDP nọ n’India si Mumbai pụta.		0.00	0.00	12.00
They are constantly upgrading, and in a few cases, the government helps.	Ha na-eme nke ọma mgbe nile, n’ọnọdụ ole na ole, gọọmenti na-enyekwara ha aka.		0.00	0.00	14.00
Education is the main event that can happen in cities.	Ihe ọmụmụ bụ ihe bụ́ isi pụrụ ime n’obodo ukwu.		0.00	0.00	10.00
What's going on in the street in Mumbai?	Olee ihe ndị na-aga n’okporo ámá dị na Mumbai?		0.00	0.00	9.00
Al Gore knows.	Al Gore maara.		0.00	0.00	3.00
There's no unemployment in squatter cities.	Ọ dịghị ọrụ ọ bụla e nwere n’obodo ukwu ndị dịpụrụ adịpụ.		0.00	0.00	12.00
One-sixth of humanity is there.	E nwere otu ụzọ n’ụzọ isii nke ụmụ mmadụ.		0.00	0.00	9.00
And here's the second punch line.	Ọ na-emekwa ka e nwee ihe ndị dị n’ụsọ oké osimiri nke abụọ.		0.00	0.00	13.00
That's the news from downtown.	Akụkọ ahụ sitere n’obodo ahụ.		0.00	0.00	5.00
Stars have shined down on earth's life for billions of years.	Kpakpando akpọwo ndụ n’ụwa ruo ọtụtụ ijeri afọ.		0.00	0.00	8.00
Now we're shining right back up.	Ugbu a, ọ na-eme ka ahụ́ ruo gị ala.		0.00	0.00	9.00
These rocks have been hitting our earth for about three billion years, and are responsible for much of what’s gone on on our planet.	Oké nkume ndị a anọwo na-akpọ ụwa anyị asị ruo ihe dị ka ijeri afọ atọ, ọ bụkwa ya na-akpata ihe ka ukwuu ná mmiri ndị dị na mbara ala anyị.		0.00	0.00	31.00
This is an example of a real meteorite, and you can see all the melting of the iron from the speed and the heat when a meteorite hits the earth, and just how much of it survives and melts.	Nke a bụ ihe atụ nke onye ọrụ afọ ofufo n’ezie, ị pụkwara ịhụ mkpịsị ugodi nile nke iron, na okpomọkụ mgbe ọ̀tụ̀tụ̀ dị oké ọnụ ahịa nke ụwa, nakwa otú ọ ga-esi lanarị ma na-adị ndụ.		0.00	0.00	37.00
From a meteorite from space, we’re over here with an original Sputnik.	Anyị si Sputnik mbụ na-aga ebe a.		0.00	0.00	7.00
This is one of the seven surviving Sputniks that was not launched into space.	Nke a bụ otu n’ime ndị Sputnik asaa ahụ na-alanarị, bụ́ ndị a na-atụghị anya ha.		0.00	0.00	16.00
The space age began 50 years ago in October, and that’s exactly what Sputnik looked like.	Njem ahụ malitere afọ 50 gara aga n’October, nke ahụ bụkwa kpọmkwem ihe Sputnik yiri.		0.00	0.00	15.00
And it wouldn’t be fun to talk about the space age without seeing a flag that was carried to the moon and back, on Apollo 11.	Ọ pụghịkwa ịbụ ihe na-enye obi ụtọ ikwu banyere nká n’ahụghị ọkọlọtọ nke ọnwa na azụ, n’Apollo 11.		0.00	0.00	18.00
The astronauts each got to carry about ten silk flags in their personal kits.	Nke ọ bụla n’ime ha malitere iburu ihe dị ka oghere iri n’akpa ha.		0.00	0.00	14.00
They would bring them back and mount them.	Ha ga-eweghachi ha ma gwa ha okwu.		0.00	0.00	7.00
So this has actually been carried to the moon and back.	N’ihi ya, e mewo nke a n’ezie ruo ọnwa ma laghachi azụ.		0.00	0.00	12.00
The dawn of books is, of course, important.	N’ezie, chi nke akwụkwọ dị mkpa.		0.00	0.00	6.00
And it wouldn’t be interesting to talk about the dawn of books without having a copy of a Guttenberg Bible.	Ọ pụghịkwa ịbụ ihe na-akpali mmasị ikwu banyere ụtụtụ akwụkwọ n’enweghị Bible Guttenberg.		0.00	0.00	13.00
You can see how portable and handy it was to have your own Guttenberg in 1455.	Ị pụrụ ịhụ otú o si dị mfe ma na-ejizi ya eme ihe iji nweta Guttenberg nke gị na 1455.		0.00	0.00	20.00
But what’s interesting about the Guttenberg Bible, and the dawn of this technology, is not the book.	Ma, ihe ọ na-akpali mmasị banyere Bible Guttenberg, na ụtụtụ nke nkà na ụzụ a, abụghị akwụkwọ ahụ                                              		0.00	0.00	63.00
You see, the book was not driven by reading.	Ị na-ahụ, ọ bụghị ịgụ akwụkwọ ahụ.		0.00	0.00	7.00
So why did the printing press succeed?	N’ihi ya, gịnị mere ndị na-ebi akwụkwọ ji nwee ihe ịga nke ọma?		0.00	0.00	13.00
This is an original page of a Guttenberg Bible.	Nke a bụ peeji mbụ nke Bible Guttenberg.		0.00	0.00	8.00
So you’re looking here at one of the first printed books using movable type in the history of man, 550 years ago.	Ya mere, ị na-ele anya n’ebe a n’otu n’ime akwụkwọ ndị mbụ e biri ebi na-eji ụdị akwụkwọ ndị a pụrụ ịdabere n’akụkọ ihe mere eme nke mmadụ, afọ 550 gara aga.		0.00	0.00	32.00
